"Address","Occurrences","Meta Description 1","Meta Description 1 Length","Meta Description 1 Pixel Width","Meta Description 2","Meta Description 2 Length","Meta Description 2 Pixel Width","Indexability","Indexability Status"
"https://mutflex.com/","2","منصة موتفلكس - الحل الرقمي المتكامل لإدارة أعمال التصنيع والتركيب في السعودية","77","427","موتفلكس - نظام SaaS متكامل لإدارة عمليات التصنيع، التوريد، والتركيب. حوّل منشأتك من الفوضى إلى نظام رقمي متكامل. تجربة مجانية لمدة شهرين.","137","759","Indexable",""
"https://mutflex.com/features","2","منصة موتفلكس - الحل الرقمي المتكامل لإدارة أعمال التصنيع والتركيب في السعودية","77","427","تعرف على جميع مميزات نظام موتفلكس: إدارة العملاء، جدولة القياسات، متابعة التصنيع والتركيب، أرشفة المستندات، التقارير الشاملة والمزيد.","133","742","Indexable",""
"https://mutflex.com/free-trial","2","منصة موتفلكس - الحل الرقمي المتكامل لإدارة أعمال التصنيع والتركيب في السعودية","77","427","ابدأ تجربتك المجانية مع موتفلكس الآن. شهرين مجاناً بدون بطاقة ائتمان مع دعم فني متكامل وتدريب مجاني.","100","548","Indexable",""
"https://mutflex.com/contact","2","منصة موتفلكس - الحل الرقمي المتكامل لإدارة أعمال التصنيع والتركيب في السعودية","77","427","تواصل مع فريق موتفلكس للاستفسارات والدعم الفني. نحن هنا لمساعدتك في رحلة التحول الرقمي لمنشأتك.","95","524","Indexable",""
"https://mutflex.com/industries","2","منصة موتفلكس - الحل الرقمي المتكامل لإدارة أعمال التصنيع والتركيب في السعودية","77","427","حلول مخصصة لكل قطاع صناعي: مصانع الرخام والجرانيت، شركات المقاولات، التشطيب والديكور، مصانع المطابخ والألمنيوم والمزيد.","119","664","Indexable",""
"https://mutflex.com/pricing","2","منصة موتفلكس - الحل الرقمي المتكامل لإدارة أعمال التصنيع والتركيب في السعودية","77","427","تعرف على أسعار باقات موتفلكس المرنة. Mutflex Pro و Mutflex Catalog مع تجربة مجانية. جميع الباقات تشمل عدد مستخدمين غير محدود.","125","705","Indexable",""
"https://mutflex.com/about","2","منصة موتفلكس - الحل الرقمي المتكامل لإدارة أعمال التصنيع والتركيب في السعودية","77","427","تعرف على قصة موتفلكس وفريقنا المتخصص في تطوير حلول تقنية لتحويل القطاع الصناعي رقمياً. رؤيتنا ورسالتنا وقيمنا.","110","608","Indexable",""
"https://mutflex.com/privacy-policy","2","منصة موتفلكس - الحل الرقمي المتكامل لإدارة أعمال التصنيع والتركيب في السعودية","77","427","تعرف على سياسة الخصوصية في موتفلكس وكيف نحمي بياناتك ومعلوماتك الشخصية.","71","394","Indexable",""
"https://mutflex.com/blog","2","منصة موتفلكس - الحل الرقمي المتكامل لإدارة أعمال التصنيع والتركيب في السعودية","77","427","اقرأ أحدث المقالات والنصائح حول إدارة التصنيع والتركيب، التحول الرقمي للمصانع، وأفضل الممارسات في القطاع الصناعي.","113","631","Indexable",""
"https://mutflex.com/blog/هل-الفنيون-هم-المشكلة-كيف-يحل-برنامج-إدارة-الفنيين-فوضى-العمل-الميداني","2","منصة موتفلكس - الحل الرقمي المتكامل لإدارة أعمال التصنيع والتركيب في السعودية","77","427","هل تعاني من فوضى العمل الميداني؟ اكتشف كيف يحل برنامج إدارة الفنيين المشكلات وينظم العمل بكفاءة عالية، مما يحسن من إنتاجيتك ورضا العملاء.","137","754","Indexable",""
"https://mutflex.com/blog/كيف-يحول-موتفليكس-عمليات-مصنعك-ومشاريعك-بالسعودية","2","منصة موتفلكس - الحل الرقمي المتكامل لإدارة أعمال التصنيع والتركيب في السعودية","77","427","اكتشف كيف يغير موتفليكس قواعد اللعبة في إدارة عمليات المصانع والمشاريع بالسعودية. عزز كفاءتك التشغيلية، قلل التكاليف، وحقق أهدافك الصناعية مع حلول موتفليكس المبتكرة.","165","917","Indexable",""
"https://mutflex.com/blog/كيف-يحل-برنامج-إدارة-مصانع-الرخام-مشاكل-الإنتاج-والتكاليف","2","منصة موتفلكس - الحل الرقمي المتكامل لإدارة أعمال التصنيع والتركيب في السعودية","77","427","اكتشف كيف يمكن لبرنامج إدارة مصانع الرخام أن يحل مشاكل الإنتاج ويخفض التكاليف بشكل فعال. حسن كفاءة مصنعك الآن!","110","602","Indexable",""
"https://mutflex.com/blog/برنامج-موتفليكس-حلول-سعودية-متكاملة-لإدارة-عملياتك-بذكاء","2","منصة موتفلكس - الحل الرقمي المتكامل لإدارة أعمال التصنيع والتركيب في السعودية","77","427","اكتشف برنامج موتفليكس، الحل السعودي المتكامل لإدارة عملياتك بذكاء. حسّن كفاءة أعمالك، قلل التكاليف، واتخذ قرارات مستنيرة. ابدأ رحلة التحول الرقمي الآن!","151","837","Indexable",""
"https://mutflex.com/blog/عملك-فوضى-لا-تنظيم-اكتشف-أفضل-برنامج-إدارة-تشغيل-الآن","2","منصة موتفلكس - الحل الرقمي المتكامل لإدارة أعمال التصنيع والتركيب في السعودية","77","427","هل تعاني من فوضى العمل؟ اكتشف أفضل برنامج إدارة تشغيل لمساعدتك في تنظيم عملياتك، تحسين الإنتاجية، وتحقيق أهدافك بكفاءة. تخلص من الفوضى وابدأ اليوم!","147","809","Indexable",""
"https://mutflex.com/blog/موتفليكس-تطبيق-كيف-تدير-عملك-وأنت-خارج-المكتب-حلول-لأصحاب-الأعمال-في-السعودية","2","منصة موتفلكس - الحل الرقمي المتكامل لإدارة أعمال التصنيع والتركيب في السعودية","77","427","اكتشف كيف يساعدك موتفليكس تطبيق في إدارة أعمالك في السعودية بكفاءة وأنت خارج المكتب. حلول ذكية لأصحاب الأعمال للبقاء متحكمين.","125","689","Indexable",""
"https://mutflex.com/blog/ليس-فقط-السعر-التكلفة-الحقيقية-لبرنامج-إدارة-المشاريع-وماذا-يجب-أن-تسأل-عنه","2","منصة موتفلكس - الحل الرقمي المتكامل لإدارة أعمال التصنيع والتركيب في السعودية","77","427","لا يقتصر الأمر على سعر برنامج إدارة مشاريع. اكتشف التكلفة الحقيقية لبرامج إدارة المشاريع وما هي الأسئلة الأساسية التي يجب أن تطرحها قبل الشراء.","143","785","Indexable",""
"https://mutflex.com/blog/موتفليكس-نظام-هل-تدير-عملك-ببرامج-أم-بمنظومة-تشغيل-متكاملة","2","منصة موتفلكس - الحل الرقمي المتكامل لإدارة أعمال التصنيع والتركيب في السعودية","77","427","هل تدير عملك ببرامج متفرقة أم بمنظومة تشغيل متكاملة؟ اكتشف كيف يمكن لـ موتفليكس نظام أن يحول مؤسستك ويحسن كفاءتها.","114","625","Indexable",""
"https://mutflex.com/blog/دليلك-الشامل-لبرنامج-تشغيل-شركات-السعودية-وحلول-تحديات-المشاريع","2","منصة موتفلكس - الحل الرقمي المتكامل لإدارة أعمال التصنيع والتركيب في السعودية","77","427","اكتشف دليلك الشامل لـ برنامج تشغيل شركات السعودية، وتغلب على تحديات المشاريع بفعالية. نقدم لك حلولاً متكاملة لتحسين الأداء وتحقيق النجاح المستدام لشركتك في السوق السعودي.","170","941","Indexable",""
"https://mutflex.com/blog/هل-عملك-مشغول-لكن-فوضوي-اكتشف-الحل-مع-أفضل-برنامج-إدارة-تشغيل","2","منصة موتفلكس - الحل الرقمي المتكامل لإدارة أعمال التصنيع والتركيب في السعودية","77","427","هل تعاني من الفوضى في عملك المزدحم؟ اكتشف أفضل برنامج إدارة تشغيل لتنظيم مهامك، تحسين كفاءتك، وتحقيق أهدافك بذكاء. ابدأ رحلة النجاح اليوم!","138","758","Indexable",""
"https://mutflex.com/blog/متابعة-مقاول-الباطن-كيف-تدير-العمل-عن-بعد-وتتغلب-على-التحديات-اليومية","2","منصة موتفلكس - الحل الرقمي المتكامل لإدارة أعمال التصنيع والتركيب في السعودية","77","427","تعرف على أفضل استراتيجيات متابعة مقاول الباطن عن بعد. تغلب على التحديات اليومية وعزز كفاءة مشروعك مع هذا الدليل الشامل للإدارة الفعالة.","135","743","Indexable",""
"https://mutflex.com/blog/ليس-فقط-السعر-دليلك-الشامل-لاختيار-نظام-إدارة-المشاريع-الأمثل-لشركتك","2","منصة موتفلكس - الحل الرقمي المتكامل لإدارة أعمال التصنيع والتركيب في السعودية","77","427","لا تدع سعر برنامج إدارة مشاريع يحدد اختيارك الوحيد! اكتشف دليلنا الشامل لتقييم أنظمة إدارة المشاريع والعثور على الحل الأمثل لشركتك.","131","722","Indexable",""
"https://mutflex.com/blog/كيف-يحل-برنامج-إدارة-مصانع-الرخام-تعقيدات-التشغيل-ويضمن-تسليم-المشاريع-بالوقت","2","منصة موتفلكس - الحل الرقمي المتكامل لإدارة أعمال التصنيع والتركيب في السعودية","77","427","اكتشف كيف يساعد برنامج إدارة مصانع الرخام في تبسيط العمليات المعقدة، وتحسين الكفاءة، وضمان تسليم مشاريعك في الموعد المحدد بكل سهولة ويسر.","137","757","Indexable",""
"https://mutflex.com/blog/وداعا-للفوضى-كيف-يحول-نظام-تتبع-مراحل-التصنيع-مصنعك-السعودي-إلى-قلعة-إنتاجية","2","منصة موتفلكس - الحل الرقمي المتكامل لإدارة أعمال التصنيع والتركيب في السعودية","77","427","حول مصنعك السعودي لقلعة إنتاجية ضد الفوضى مع نظام تتبع مراحل التصنيع المتطور. عزز كفاءتك، دقة بياناتك، وجودة منتجاتك الآن!","122","671","Indexable",""
"https://mutflex.com/blog/برنامج-إدارة-المشاريع-في-السعودية-حلول-لتحديات-أعمالك","2","منصة موتفلكس - الحل الرقمي المتكامل لإدارة أعمال التصنيع والتركيب في السعودية","77","427","اكتشف أفضل برنامج إدارة مشاريع في السعودية لمواجهة تحديات عملك. عزز إنتاجيتك وحقق أهدافك بكفاءة عالية مع حلولنا المبتكرة والفعالة.","130","719","Indexable",""
"https://mutflex.com/blog/وداعا-لفوضى-الفروع-كيف-يحول-برنامج-إدارة-الفروع-عملك-إلى-منظومة-متكاملة","2","منصة موتفلكس - الحل الرقمي المتكامل لإدارة أعمال التصنيع والتركيب في السعودية","77","427","اكتشف كيف يحوّل برنامج إدارة الفروع عملك إلى منظومة متكاملة ومنظمة. قل وداعاً لفوضى الفروع وعزز كفاءة عملك الآن!","112","614","Indexable",""
"https://mutflex.com/blog/موتفليكس-الحل-الذكي-لإدارة-مصانع-وشركات-المقاولات","2","منصة موتفلكس - الحل الرقمي المتكامل لإدارة أعمال التصنيع والتركيب في السعودية","77","427","اكتشف موتفليكس، الحل الذكي لإدارة مصانعك وشركات المقاولات بكفاءة عالية. تحسين العمليات، متابعة المشاريع، وإدارة الموارد بسهولة. جرب موتفليكس الآن لتعزيز إنتاجيتك وتحقيق أهدافك.","176","981","Indexable",""
"https://mutflex.com/blog/موتفليكس-لإدارة-المصانع-تحول-رقمي-نحو-كفاءة-أعلى-وإنتاجية-مثلى","2","منصة موتفلكس - الحل الرقمي المتكامل لإدارة أعمال التصنيع والتركيب في السعودية","77","427","اكتشف كيف تحدث موتفليكس إدارة المصانع ثورة في التشغيل. مع موتفليكس، حقق تحولًا رقميًا نحو كفاءة أعلى، إنتاجية مثلى، وتحكم كامل في مصنعك.","136","746","Indexable",""
"https://mutflex.com/blog/منصة-إدارة-الإنتاج-للألمنيوم-حلول-مبتكرة-لتعزيز-الكفاءة-والربحية","2","منصة موتفلكس - الحل الرقمي المتكامل لإدارة أعمال التصنيع والتركيب في السعودية","77","427","اكتشف كيف تحدث منصة إدارة الإنتاج لشركة ألمنيوم ثورة في عملياتك. حلول مبتكرة لتعزيز الكفاءة، تقليل التكاليف، وزيادة الربحية في صناعة الألمنيوم.","143","791","Indexable",""
